{"asset":{"description":"Protocol-neutral C99 on Linux/POSIX sockets with warning-clean make variants.","id":"c99-posix","version":"1.0.0"},"build_variants":[{"command":["make"],"compiler_flags":["-std=c99","-Wall","-Wextra","-Werror","-O0","-g"],"description":"Warning-clean debug-friendly build.","id":"release","required":true,"sanitizers":[]},{"command":["make","SAN=1"],"compiler_flags":["-std=c99","-Wall","-Wextra","-Werror","-O0","-g"],"description":"AddressSanitizer and UndefinedBehaviorSanitizer build.","id":"san","required":true,"sanitizers":["address","undefined"]}],"file_types":{"header_extensions":[".h"],"include_directories":["include"],"source_extensions":[".c"]},"language":{"extensions":[],"id":"c","standard":"c99"},"platform":{"api_families":["posix-sockets","posix-select"],"os":"linux"},"runtime_constraints":{"constraints":["Codec paths never allocate dynamically.","One-time caller-owned storage allocation for opaque session/core objects is allowed.","Check external lengths before access."],"dynamic_allocation":"restricted","network_apis":["socket","select"],"third_party_dependencies":"forbidden","threads":"forbidden"},"schema_version":"1.0","source_ref":{"path":"profiles/languages/c99-posix.source.json","sha256":"0b9800b5cb9174944bd4c2423755197959b3d86d33a7cdab01bb4fee94946ab5"},"style":{"indent_spaces":4,"max_file_lines":400,"max_function_lines":80,"production_assertions":"forbidden","warnings_as_errors":true},"toolchain":{"archiver":"ar","build_file_template":{"path":"profiles/templates/c99-posix/Makefile.j2","sha256":"a1e1f419687acf62ee706f2d001c932f544039e6e3ffd6d42ecfbb98298f755f"},"build_system":"gnu-make","compiler":"gcc"},"type_mappings":[{"id":"uint8-scalar","match":{"shape":"scalar","spec_type_id":"uint8"},"mechanical_rule":"Use stdint.h uint8_t.","representation":"uint8_t"},{"id":"uint16-scalar","match":{"shape":"scalar","spec_type_id":"uint16_be"},"mechanical_rule":"Store host order; convert only in codec code.","representation":"uint16_t"},{"id":"uint32-scalar","match":{"shape":"scalar","spec_type_id":"uint32_be"},"mechanical_rule":"Store host order; convert only in codec code.","representation":"uint32_t"},{"id":"decoded-varint","match":{"encoding_kind":"varint","shape":"scalar"},"mechanical_rule":"Store the decoded scalar; encode only at the wire boundary.","representation":"uint32_t"}]}